Name,产业,員工人數,网站,代表人物,總資產,成立,總部
网站类型,,,http://www.people.com.cn,,,,
上海电影（集团）公司,电影业,,http://www.sfs-cn.com,任仲伦 （ 总裁 ）,,1949年 ( 上海电影制片厂 ) 2001,中国 上海市 徐汇区 漕溪北路 595号
华电国际电力股份有限公司,电力,,http://www.hdpi.com.cn/,赵建国 （ 董事长 ） 陈斌 （副董事长兼黨委書記） 王映黎 （副董事长） 田洪寶 （董事总经理） 李晓鹏 （监事会主席）,,1994年6月28日,中国 北京市 西城区 宣武门 内大街2号
河南黄河旋风股份有限公司,制造企业,,http://www.hhxf.com/,,,1998年,长葛市 人民路200号
大秦鐵路股份有限公司,鐵路 營運,,http://www.daqintielu.com/,董事長 ：杨绍清 总经理 ：关柏林,,2004年,中國 太原
上海申通地铁集团有限公司,城市轨道交通系统 运营及相关开发；持有 上海地铁一号线 部分列车和20年经营权。,,http://www.shmetro.com/,董事长 ： 俞光耀,,1992年6月12日（上海凌桥自来水股份有限公司） [1],上海市 桂林路909号
上海石油化工股份,化學工業,"11,088（2016年） [1]",https://web.archive.org/web/19981205064015/http://www.spc.com.cn/,董事長 ： 吳海君 (暫代),,1972年,中國 上海市 金山区
上海机场（集团）有限公司,航空,,http://www.shairport.com/,董事长： 贾锐军,,1998年2月11日 [3],中国 上海市 浦东机场 启航路900号（2000年前为 虹桥路 2550号） [4] [3]
中國長江電力股份有限公司,水力發電,,http://www.cypc.com.cn/,董事長 ：李永安,,2002年11月4日,中国 北京市 西城区 金融大街19号富凯大厦B座
錦江國際（集團）有限公司,酒店 、 餐飲 服務 、 旅遊 客運 等,,http://www.jinjiang.com/,俞敏亮 （ 董事长 、 党委书记 ）,,1991年4月13日 2003年合并重组,中国 上海市 黄浦区 延安东路 100号 联谊大厦 23楼
铜陵化学工业集团有限公司,化学工业,7000余人 [2],http://www.tlchem.com.cn/,董事长 ： 陈嘉生,,1991年,中华人民共和国 安徽省 铜陵市 翠湖1路2758号
中国银河证券股份有限公司,投资银行,,http://www.chinastock.com.cn,,,,中華人民共和國 北京市 西城区 金融大街35號國際企業大廈C座
廈門金龍聯合汽車工業有限公司,製造、銷售,,http://www.king-long.com.cn/,董事長：郭清泉 總經理：孫建華,,1988年,中华人民共和国 福建省 廈門市
安徽金种子酒业股份有限公司,制造业,,http://www.jzz.cn/,董事长 ： 宁中伟,,1998年7月,中国 安徽省 阜阳市 颍州区 莲花路259号
金地(集团)股份有限公司,房地产开发,6958人（2009年度）,http://www.gemdale.com/,董事长： 凌克,,1988年1月20日,深圳市 福田区
酒泉钢铁（集团）有限责任公司,钢铁,,http://www.jiugang.com/,董事長 ： 冯杰,,1958年,中国 甘肃 嘉峪关
重庆水务,供水 、排水、工程施工,,http://www.cncqsw.com/,董事長 ：武秀峰,,2001年,中國 重庆 渝中区 龙家湾1号
贵人鸟股份有限公司,輕工業,5000人以上,http://kbird.jd.com,林天福 董事主席 王奋 独立董事,,1987年,中华人民共和国 晋江市陈埭沟西工业区
安徽迎驾贡酒股份有限公司,制造业,6608人 [1],http://www.yingjia.cn/,董事长 ： 倪永培,,2003年11月28日 [1],中国 安徽省 六安市 霍山县 佛子岭镇
财通证券股份有限公司,金融业,,,,,1993年 ，​26年前 ​（ 1993 ）,中国 浙江省 杭州市
山西通宝能源股份有限公司,,,,,,1992年,中國 山西省 太原市
上海豫園旅游商城股份有限公司,商場 管理 和 零售,,http://www.yuyuantm.com.cn/,董事長 ：叶凯 總經理 ：梅红健,,1992年,中国 上海市 黄浦区 方浜中路 269号
贵州茅台酒股份有限公司,酒,,http://www.moutaichina.com,董事長 ： 李保芳,,1999年,中國 貴州 仁怀市 茅台镇
遼寧成大股份有限公司,綜合企業,,http://www.chengda.com.cn/,董事長 ：尚書志,,1993年,中國 遼寧 大連
华發实业股份有限公司,地產 、 物业,,http://www.cnhuafas.com,,,1992年8月18日,中国 广东省 珠海市
浙江莎普爱思药业股份有限公司,制药,"2,040人（2017年） [1]",http://www.zjspas.com/,陈德康 （董事长）,,1978年,中华人民共和国 浙江省 嘉兴市 平湖市 经济开发区新明路1588号
上海老凤祥有限公司,珠宝首饰,"1,839人（2009年）",http://www.laofengxiang.com/,胡书刚 （法定代表人，董事长）,,1848年（老凤祥 银楼 ） 1935年10月8日（正式营业）,上海市 漕溪路 260号
紫金礦業,礦業,,http://www.zjky.cn/,,,2000年,中华人民共和国 福建省 龍岩市 上杭县
西部礦業股份有限公司,礦業,,http://www.westmining.com/,董事長 ：汪海涛,,2000年,中國 青海 西寧
长江精工钢结构（集团）股份有限公司,建筑业,,,董事长 ： 方朝阳,,1999年,中国 安徽省 六安市 经济技术开发区长江精工工业园
神華集團,煤炭 、 能源,25萬人,http://www.shenhuagroup.com.cn/,,,1995年10月,中华人民共和国 北京
湖南科力远新能源股份有限公司,制造业,,http://www.corun.com,,,1998年,中国 湖南省长沙市
哈尔滨秋林集团股份有限公司,零售业、食品制造业等,,http://www.qlgroup.com.cn,,,1867年， 俄罗斯帝国 庙街 1900年， 大清 黑龙江将军 辖区 哈尔滨 （今中国黑龙江省哈尔滨市）,中国 黑龙江省 哈尔滨市 南岗区 东大直街319号
安徽皖江物流（集团）股份有限公司,交通运输,,http://www.whpstc.com/,法人代表 ： 张宝春,,2000年11月,中华人民共和国 安徽省 芜湖市 长江中路港一路16号
安徽新华传媒股份有限公司,服务业,,http://www.wxm.com/,董事长 ： 吴文胜,,2002年10月25日,中国 安徽省 合肥市 包河区 北京路8号
新疆百花村股份有限公司,,,http://www.xjbhc.net,,,,
盛和资源控股股份有限公司,,,http://www.scshre.com/,,,,
广州珠江实业开发股份有限公司,房地产开发与经营业,,http://www.gzzjsy.com,董事長 ：郑暑平,,1985年,中国 广东省 广州市 环市东路 362-366号好世界广场30楼
用友软件股份有限公司,信息技术,,http://www.yonyou.com/,董事长兼总裁： 王文京,,1988年,北京市
申能股份有限公司,能源 投資,,http://www.shenergy.net.cn/,董事長 ：仇偉國,,1992年,中國 上海
南京熊猫電子股份公司,信息工程 電子,,http://www.panda.cn/,,,"中國,南京 (1936)","中國,南京"
熊猫金控股份有限公司,互联网金融、烟花燃放,,http://www.600599.com.cn/,,,,中國 北京
玲珑轮胎,轮胎制造商,"13,300",http://en.linglong.cn/,王锋 ( 董事长 ),,1975年 ，​44年前 ​（ 1975 ）,中国 山东 烟台 招远市 金龙路777号
湖南新五丰股份有限公司,以生猪产业经营及出口业务为主,,http://www.newwf.com/,公司董事长邱卫,,,湖南省 长沙市 五一西路 2号第一大道19-20楼
湖北长江出版传媒集团股份有限公司,出版、发行、报纸与新媒体经营、印刷、印刷物资销售,,http://www.cjcb.com.cn/,,,2004年,中国 湖北省 武汉市 洪山区 雄楚大街268号
海通證券股份有限公司,證券,,http://www.htsec.com/,董事長 ：王開國,,1988年,中国 上海
海航集团有限公司,航空业，旅游业，金融服务业，房地产业，物流业,,http://www.hnagroup.com/,陈峰 （董事局主席、董事长） 谭向东 （首席执行官） 李先华（副董事长） 逯鹰（副董事长） 张岭（首席执行官）,,1998年4月16日,中国 海口 - 新海航大廈
同方股份有限公司,資訊科技 、 能源 、 環境,,http://www.thtf.com.cn/,董事長 ：陆致诚,,1997年,中华人民共和国 北京市 清華科技園
海航基础设施投资集团,,,http://www.hnainfrastructure.com,黄秋 （董事长） 曾标志 （首席执行官 兼副董事长）,,,中國海南省海口市 国兴大道5号 海南大厦海航实业中心46层
淮南矿业（集团）有限责任公司,煤炭、电力、房地产、物流、金融、技术服务,,http://www.hnmine.com/,孔祥喜、王世森,,1998年 ​（21年前） ​（ 1998 ）,中华人民共和国 安徽省 淮南市 洞山中路1号
海澜之家股份有限公司,,,"http://www.heilan.com.cn/,http://www.hlamall.cn/,http://www.eichitoo.com/,http://www.sancanal.com/",顾东升,,1997年1月8日,中国 江苏省 江阴市 新桥镇
海尔集团,综合性产业,"78,000",http://www.haier.com/,张瑞敏 （ 首席执行官 ）,,1984年4月28日 ，​35年前 ​（ 1984-04-28 ）,中华人民共和国 山東省 青岛市 海尔路1号 海尔工业园内
浙江海正药业股份有限公司,,,http://www.hisunpharm.com,总裁：李琰,,,浙江省 台州市
海南航空,,,https://www.hnair.com,,▲ 人民币1253.81亿元(2015),,
海信集团有限公司,电器及电子,15776人,http://www.hisense.com/,周厚健 （董事长）,,1969年9月 ，​50年前 ​（ 1969-09 ）,中国 山东省 青岛市 市南区 东海西路 17号海信大厦
浪潮集团,服务器 、 计算机 、 存储 、 特种计算机 、 資訊安全产品 、 网络 、 ERP 、 軟體,30000,http://www.inspur.com,孙丕恕 (董事长),,,中国 济南 高新区浪潮路1036号
浙江香飘飘食品有限公司,食品製造業,2000多人,http://www.zjxpp.com/,董事長 ： 蒋建琪,,2005年8月,中国 中国 浙江省 湖州市
海南天然橡胶产业集团股份有限公司,种植业,,http://www.hirub.cn/index1/index.jsp,董事长 ：林进挺,,2005年,中国 海南省 海口市 海垦路13号绿海大厦
洛陽欒川鉬業股份,鉬 業,,http://www.clcmo.com/,董事長 ： 李朝春,,1982年,中國 河南 洛陽 欒川
清华控股有限公司,信息技术 、 能源环保 、 生命科技 、 科技服务 、 知识产业,,http://www.thholding.com.cn,李勇 （副董事长、党委书记）,,2003年,中华人民共和国 北京市
浙商证券股份有限公司,金融业,,,,,2002年 ，​17年前 ​（ 2002 ）,中国 浙江省 杭州市
泰豪集团有限公司,军工 、 电气 、 节能 环保 、 创投,,http://www.tellhow.cn/,,,1988年7月,中国
江苏银行,金融,14046人（2015年12月末）,http://www.jsbchina.cn/,,,2007年1月24日,中国 江苏省 南京市 玄武区 洪武北路55号
洛陽玻璃股份有限公司,玻璃 生產 及 銷售,,http://www.zhglb.com/,董事長 ： 宋建明 總經理 ： 倪植森,,1994年,中国 河南 洛陽
沈阳机床集团有限责任公司,机械制造业,1.8万人,http://www.smtcl.com/,董事长： 关锡友,,1995年12月,沈阳
宁波波导股份有限公司,移动通信,,http://www.chinabird.com/,董事長 ： 徐立华,,1993年,中国 浙江省 宁波市 奉化区 大成东路999号
江苏省广电有线信息网络股份有限公司,媒体业,,http://www.jscnnet.com/,顾汉德 （总裁）,,2008年7月21日,中国 江苏省 南京市 江东中路 222号南京奥体体育科技中心六楼（注册地址） 北京东路 4号江苏广电城25楼（营业地址） [1]
江西銅業股份,銅 業,"34,000人",http://www.jxcc.com/,董事長 ：龙子平,,1979年7月,中國 江西 南昌 昌东大道7666号
永辉集团,零售业,84931人（2017年12月31日）,http://www.yonghui.com.cn/,,,中國 福建 福州市 （1995年）,中國 福建 福州市 西二環中路436號
安徽江淮汽车集团股份有限公司,汽车制造业,,http://www.jac.com.cn/,安进 [1],,1964年,中国 安徽省 合肥市 包河区 东流路 176号 [2]
江苏恒瑞医药,医药,,http://www.hrs.com.cn/,,,1997年,中国 江苏省 连云港
广西桂冠电力股份有限公司,电力生产业,,http://www.ggep.com.cn/,董事长 ：蔡哲夫,,1992年,中国 广西壮族自治区 南宁市 民主路北四里6号
山东步长制药股份有限公司,制药业,"8,004人（2018年） [1]",http://www.buchang.com,赵涛 （董事长）,,1993年8月28日（咸阳步长制药有限公司） 2001年5月12日（上市主体）,中华人民共和国 山东省 菏泽市 中华西路369号
安徽梦舟实业股份有限公司,冶金,,http://web.ahxinke.com/,董事长 ： 张志,,1998年9月28日,中国 安徽省 芜湖市 经济技术开发区珠江路3号
株洲冶炼集团,,,http://www.torchcn.com,,,1956年,湖南省株洲市
杭州银行股份有限公司,金融业,,http://www.hzbank.com.cn,董事长 ：陈震山 行长：宋剑斌,,1996年9月26日,中国 浙江省 杭州市 庆春路46号杭州银行大厦
東方集團股份有限公司,綜合企業,,http://www.china-orient.com/,董事長 ：張宏偉,,1978年,中國 黑龍江 哈爾濱
春兰（集团）公司,家用电器,,http://www.chunlan.com/,陶建幸 （董事长）,,1985年,中国 江苏省 泰州市
上海晨光文具股份有限公司,文具制造,,,陈湖文(CEO),,中国 上海市 奉贤区,中国 上海市 奉贤区
春秋航空,,,https://www.ch.com,,,,
时代出版传媒股份有限公司,传媒,3133人 [1],http://www.press-mart.com/,董事长 ： 王民,,1999年12月12日 [1],中华人民共和国 安徽省 合肥市 蜀山区 翡翠路1118号出版传媒广场
明天科技,,,http://www.tomotech.com,李国春 ( 董事长 ),,1997,中国 包头
方正科技集團股份有限公司,資訊科技,,http://www.foundertech.com/,董事長 ：方中華,,1986年,中國 上海
新華人壽保險股份有限公司,金融 （ 保險 為主）,"57,000人",https://www.newchinalife.com,,,1996年,中國 北京
方正證券股份有限公司,证券投资,,http://www.foundersc.com,董事長： 雷杰 总裁 ：王红舟,,1988年6月6日，前身为浙江省证券公司,中华人民共和国 湖南 长沙市 芙蓉中路 二段华侨国际大厦22—24层
昆药集团股份有限公司,制药业,,http://www.kpc.com.cn,汪思洋（董事长）,,2002年4月8日（注册时间）,中国 云南省 昆明市 高新技术产业开发区 科医路166号
招商證券股份有限公司,證券,,http://www.newone.com.cn,董事長 ：宮少林 [1],,1991年,中国 广东省 深圳市 福田区 益田路 江苏大厦 38-45层
招商局能源運輸股份有限公司,能源 運輸,,http://www.cmenergyshipping.com/,董事長 ： 傅育寧,,2004年,中國 上海
惠而浦,家用电器,"68,000 (2012) [1]",http://www.whirlpoolcorp.com/,杰夫·费迪 ， 董事长 兼 CEO,,1911,"美国 密歇根州 本顿港 （ 英语 ： Benton Charter Township, Michigan ）"
山东新华医疗器械股份有限公司,医疗器械制造业,,http://www.shinva.net/,董事长 ： 赵毅新,,1942年,中国 山东 淄博
上海振华重工(集团)股份有限公司,港口 起重機 製造,,http://cn.zpmc.com/,創始人：管彤贤 [1] 董事長 ：朱连宇 總裁 ：黄庆丰,,1992年,中国 上海市 浦东新区 东方路 3261号
网站类型,,,"http://www.xinhuanet.com/,https://www.wikidata.org/wiki/Q11081577#P856",,,,
復星醫藥,製藥 醫療,,https://www.fosunpharma.com,陈启宇 (主席) 姚方 (CEO),,1994,中华人民共和国
安徽应流机电股份有限公司,专用设备 制造业,3970人 [1],http://www.yingliugroup.com/index.asp,董事长 ： 杜应流,,2000年8月4日 [1],中华人民共和国 安徽省 合肥市 蜀山区 经济技术开发区繁华大道566号
山西广誉远国药有限公司,,,http://www.gyysx.com/,,,1541年,山西省 太谷县 新建路171号
广深铁路股份有限公司,鐵路運輸,,http://www.gsrc.com/,,,1983年12月15日（广深铁路公司） 1996年3月6日（广深铁路股份有限公司）,中国 广东省 深圳市 罗湖区 和平路1052号
广州汽车集团股份有限公司,汽车制造业,,http://www.gagc.com.cn/2009/,董事長 ：张房有,,1997年,中国 广东省 广州市 越秀区 东风中路 448-458号成悦大厦23楼
广州广日股份有限公司,专用设备制造业,,http://www.guangrigroup.com/,董事长 ：潘胜燊,,1989年,中国 广东省 广州市 天河区 华利路59号东塔13层自编1301
廣州白雲山醫藥集團股份有限公司,医药制造业,,http://www.gpc.com.cn,,,1997年,中国 广东省 广州市 沙面北街45号
广州白云山制药股份有限公司,医药制造业,,http://www.gzbys.com/,董事长 ：李楚源,,1992年,中国 广东省 广州市 白云区 同和街 云祥路88号
广州白云国际机场股份有限公司,机场及航空运输辅助业,,http://www.baiyunairport.com,邱嘉臣（董事長）,,2000年9月19日,中国 广东省 广州市 广州白云国际机场南工作区自编一号
山西煤炭进出口集团有限公司,,,http://www.shanxicoal.cn/,,,1980年,中國 山西省 太原市 府西街 36号煤炭进出口大厦
山西焦化集团有限公司,,,http://www.sxjh.com.cn/,,,1969年,中國 山西省 临汾市 洪洞县
鲁商集团,零售业 ， 地产业 ， 制药业 ， 酒店业 ， 教育业 ， 传媒业,15万人（2015年）,http://www.lshjt.com.cn/,董事长：王仁泉 总经理：凌沛学,,,济南市 山师东路4号
山东黄金集团,矿业，金融，房地产,"12,793 (2015)",http://www.sd-gold.com/,李国红 (董事长),,1975年 ，​44年前 ​（ 1975 ）,中国 山东 济南 舜华路2000号舜泰广场3号楼
广州发展集团股份有限公司,电力生产业,,http://www.gdih.cn,,,1996年,中国 广东省 广州市 天河区 临江大道3号28-30楼
安琪酵母股份有限公司,酵母及深加工产品行业90.34%，奶制品行业1.38%，包装行业1.72%，其他行业6.55%,"1,331",http://www.angelyeast.com/,,,1986年,中国 湖北省 宜昌市 城东大道168号 （原中南路24号）
安徽水利开发股份有限公司,建筑业,,http://www.cahsl.com/,董事长 ： 王厚良,,1998年6月,中国 安徽省 蚌埠市 禹会区 东海大道张公山南侧
安徽海螺集团有限责任公司,制造业,,http://www.chinaconch.com/,董事长 ： 高登榜,,1996年9月,中国 安徽省 芜湖市 文化路39号
安徽合力股份有限公司,工程机械,,http://www.helichina.com/,董事長為 張德進 ，以及總裁為 薛白,,1958年,安徽 合肥市 经开区
宁波舟山港（集团）股份有限公司,交通运输业 /仓储和邮政业 水上运输业,,"http://www.portnbzs.com.cn/,http://www.nbport.com.cn/",董事长 ： 毛剑宏 总经理 ： 宫黎明,,2004年4月8日,中华人民共和国 浙江省 宁波市 鄞州区 宁东路269号 宁波环球航运广场
鄭州宇通客車股份有限公司,汽车,,http://www.yutong.com/,汤玉祥,,1963年,中华人民共和国 河南省 鄭州市 管城回族区 宇通路宇通工业园
安徽海螺水泥股份有限公司,水泥 生產 和 銷售,,http://www.conch.cn/,董事长 ： 郭文三,,1997年,中华人民共和国 安徽省 芜湖市
江蘇寧滬高速公路股份有限公司,公路 建造 及 營運,,http://www.jsexpressway.com/,董事長 ：沈長全,,1992年,中國 江蘇 南京
太原重型机械集团有限公司,机械,,http://www.tz.com.cn,,,1950年,中国 山西 太原
天润乳业,,,,,,,新疆乌鲁木齐市经济技术开发区(头屯河区)乌昌公路2702号
三六零安全科技股份有限公司,互联网 、 软件,,https://www.360.com/,徐祚立、石晓虹、姚珏、齐向东、周鸿祎、李湘,,2005年9月,中国 北京 朝阳区 酒仙桥路6号院（电子城国际电子总部）2号楼
重庆太极实业（集团）股份有限公司,医药制造业,13000,http://www.taiji.com/Default.aspx,,,1993年12月28日 ，​25年前 ​（ 1993-12-28 ）,中国 重庆市 渝北区黄泥磅龙塔街道黄龙路38号
天津港股份有限公司,港口 營運,,http://www.tianjin-port.com/,主席 ：于汝民,,1996年,中國 天津
太原理工天成科技股份有限公司,,,http://www.tichn.com/,,,1998年,中國 山西省 太原市
天津劝业场大楼,,,,,,,中国 天津
大連港股份有限公司,港口,,http://www.dlport.cn/,董事長 ：孫宏,,2005年,中國 遼寧 大連
天津市房地产发展（集团）股份有限公司,房地产开发,,,,,,中华人民共和国 天津市 和平区常德道80号
大唐电信科技股份有限公司,通信,,http://www.datang.com,,,1998年,中华人民共和国 北京市
天士力控股集团,医药,,http://en.tasly.com/,,,1994年 ，​25年前 ​（ 1994 ）,中国 天津 北辰区 普济河东道2号天士力大健康城
大唐国际发电,電力,,http://www.dtpower.com/,董事長 ：翟若愚,,1994年,中國 北京
大同煤業,煤炭,,http://www.dtmy.com.cn,张有喜 （ 董事長 ） 武望国 （ 副董事长 兼 总经理 ） 于大海 （ 董事 兼 党委书记 ） 王宏 （ 监事会 主席）,,2001年7月25日 ( 2001-07-25 ),中國 山西 大同
国泰君安国际控股有限公司,证券业,500人（ 2019年 ）,http://www.gtjai.com,阎峰（ 董事长 ）,,1995年,香港
国金證券股份有限公司,證券,,,董事長 ：冉云,,1988年7月20日,中國 · 四川 · 成都
均瑶集团,航空 、 零售,,http://www.juneyao.com,王均瑶 （创始人） [1] 王均金 （董事长） 王均豪 （总裁）,,1991年,中国 上海 肇嘉浜路789号均瑶国际广场10至19层
国泰君安证券股份公司,金融业,,http://www.gtja.com/portal/,杨德红（ 董事长 ） 王松（ 总裁 ）,,1992年,中国 上海
国投电力控股股份有限公司,火力/水力发电,,http://www.sdicpower.com/,董事長 ：董事长,,,中国 北京市 西城区 西直门南小街147号5号楼
國電電力發展股份,電力,,http://www.600795.com.cn/,董事長 ：朱永芃,,1992年,中國 北京
四川成渝高速公路股份有限公司,公路基建,600（2013年）,http://www.cygs.com/,,,1997年,四川省成都市
雲南馳宏鋅鍺股份有限公司,金屬,,http://www.chxz.com/,董事長 ：董英,,2000年,中國 雲南 曲靖
黄山旅游发展股份有限公司,旅游业,,http://www.huangshan.com.cn/,董事长 ： 章德辉,,1996年,中国 安徽省 黄山市 屯溪区 天都大道5号
马应龙药业集团股份有限公司,制药,,http://www.mayinglong.cn/,,,1582年,中国 湖北省 武汉市 武昌区 南湖 周家湾100号
馬鞍山鋼鐵股份有限公司,鋼鐵,,http://www.magang.com.hk/,董事長 ： 顧建國 黨委書記 ：顧章根 總經理 ：朱昌逑,,1993年,中國 安徽 馬鞍山
鴻海科技集團,電子工業,130萬人（2015）,http://www.foxconn.com/,董事長：劉揚偉 副董事長：李傑,,1974年2月20日 ( 1974-02-20 ) （45年229天）,中華民國 新北市 土城區
青岛海尔股份有限公司,,,http://www.haier.net,法人代表 ： 杨绵绵 、 总经理 ： 梁海山,,,中国 山东省 青岛市 市北区 重庆南路99号
青岛啤酒股份有限公司,,,http://www.tsingtao.com.cn/index.shtml,董事长：孙明波,,1903年,中国 山東省 青岛市
际华集团股份有限公司,军需轻工,,http://www.jihuachina.com/,,,2009年6月26日,中国 北京市 朝阳区 东三环中路财富中心A座
陕西广电网络传媒股份有限公司,电视广播,,http://www.sxbctv.com/,,,2001年,中国 陕西省 西安市 曲江新区曲江行政商务区曲江首座大厦
阿里巴巴集團,B2B 貿易 、 網上零售 、 購物搜索引擎 、 第三方支付 、 雲計算 服務等,"66,421 (2018年3月31日)","//news.alibaba.com/specials/aboutalibaba/aligroup/index.html,http://page.china.alibaba.com/shtml/about/ali_group1.shtml",,,1999年,中华人民共和国 杭州市 滨江区 网商路699号
四川长虹电器股份有限公司,军工、家电、数码、通讯、内容提供,在职27580人 离退休3166人 (2006年12月31日),http://cn.changhong.com/,创办人 马璋 前任董事长兼总经理 倪润峰 董事长 赵勇 集团公司总经理 杨学军 股份公司总经理 刘体斌 多媒体产业公司董事长 林茂祥 多媒体产业公司总经理 徐明,,1958年10月 ，​61年前 ​（ 1958-10 ） 1965年3月正式更名长虹,1958年-1997年 中国 四川省 绵阳市 跃进路4号 1997年-至今 中国 四川省 绵阳市 高新区绵兴东路35号
吉祥航空,,,http://www.juneyaoair.com,,,,
Great Wall Motor,汽车制造业,7万,http://www.gwm.com.cn/,魏建军（ 董事长 ）,,1984年 ，​34年前 ​（ 1984 ）,中国 河北省 保定市 长城大街 38°48′55.41″N 115°27′25.59″E ﻿ / ﻿ 38.8153917°N 115.4571083°E ﻿ / 38.8153917; 115.4571083
厦门国际航空港股份有限公司,交通运输,,http://www.xiac.com.cn/,董事长兼总经理：王倜傥,,1996年5月,福建省 厦门市
厦门建发股份有限公司,供应链 运营,,http://www.chinacnd.com/,董事长：吴小敏,,1998年6月10日,福建省 厦门市
中国绍兴黄酒集团有限公司,酿酒 业,4100人,http://www.shaoxingwine.com.cn/,,,1994年（集团） 1997年（股份）,中国 浙江省 绍兴市 北海桥
安徽口子酒业股份有限公司,制造业,,http://www.kouzi.com/,董事长 ： 徐进,,2002年,中国 安徽省 淮北市 相山南路9号
同仁堂,生物醫學,,http://www.tongrentang.com/,樂顯揚 、 樂達聰 、樂松生,,1669年 （ 清 康熙 八年）,中华人民共和国
南京鋼鐵股份,鋼鐵,,http://www.600282.net/,董事長 ：肖同友 副董事長 ： 郭廣昌,,1999年,中國 江蘇 南京
南京银行,金融业,约8000,http://www.njcb.com.cn,董事长： 胡昇荣,,1996年,中国 江蘇省 南京市 中山路288号
华锐风电科技(集团)股份有限公司,风力发电,,http://www.sinovel.com/,,,2004年 ( 2004 ) ( 北京 ),中国 北京
华能澜沧江水电,公用事业,,http://www.hnlcj.cn,袁湘华 （ 董事长 兼 党委书记 ） 杨万华 （副董事长） 李双友 （副董事长） 孙卫 （ 董事 总经理 兼 党委 副书记） 叶才 （ 监事会 主席）,,2001年2月8日 ( 2001-02-08 ),中國云南省昆明市
华能国际电力,电力,,http://www.hpi.com.cn/,董事长 ： 曹培玺,,1994年,中国 北京
华电能源,能源,,http://www.hdenergy.com,董凤亮 （ 董事长 兼 总经理 兼 党委书记 ） 曹晓峰 （ 监事会 主席）,,1993年2月2日 ( 1993-02-02 ),中國黑龍江省哈尔滨市
